{
  "country_identity": {
    "country_name": "Serbia",
    "iso2": "RS",
    "iso3": "SRB",
    "pack_version": "0.1.0",
    "population_year": 2022,
    "preferred_language": "en",
    "local_languages": ["sr-Latn", "sr-Cyrl"],
    "currency": "RSD",
    "build_date": "2026-06-18"
  },
  "coverage_scope": {
    "target_population": "adult_purchase_decision_makers",
    "base_population_reference": {
      "value": 6647003,
      "year": 2022,
      "source_name": "Statistical Office of the Republic of Serbia, Census 2022",
      "source_url": "https://www.stat.gov.rs/en-us/vesti/20230428-konacnirezpopisa/?a=0&s=1904",
      "coverage_note": "Use SORS coverage notes consistently. Several SORS statistical series state that data for AP Kosovo and Metohija are unavailable or excluded after 1999. Downstream reports must state the exact coverage used by each source table."
    },
    "sex_distribution_anchor": {
      "male": {"count": 3231978, "share": 0.486},
      "female": {"count": 3415025, "share": 0.514}
    },
    "use_case": "synthetic consumer panel generation, pricing simulation, product A/B choice, segment lift"
  },
  "source_priority": [
    {
      "rank": 1,
      "source_type": "national_statistical_office",
      "source_name": "Statistical Office of the Republic of Serbia",
      "source_url": "https://www.stat.gov.rs/",
      "use_for": ["population", "sex", "education", "computer_literacy", "households", "ICT", "labour", "income"]
    },
    {
      "rank": 2,
      "source_type": "official_census_portal",
      "source_name": "Census 2022 Serbia portal",
      "source_url": "https://popis2022.stat.gov.rs/",
      "use_for": ["census books", "municipality tables", "regional tables", "education", "literacy", "households"]
    },
    {
      "rank": 3,
      "source_type": "international_statistical_sources",
      "source_name": "World Bank / Eurostat / ILO / ITU / UN",
      "source_url": "https://data.worldbank.org/country/serbia",
      "use_for": ["fallback population indicators", "international harmonisation", "cross-country comparability"]
    },
    {
      "rank": 4,
      "source_type": "category_or_product_sources",
      "source_name": "retail/product pages and market reports",
      "source_url": "",
      "use_for": ["product facts only", "category context only", "never hard population weights"]
    }
  ],
  "required_tables": [
    {
      "file_name": "census_population_total_sex.csv",
      "grain": "country x sex",
      "variables": ["country", "sex", "population_count", "population_share"],
      "source_name": "Statistical Office of the Republic of Serbia, Census 2022",
      "source_url": "https://www.stat.gov.rs/en-us/vesti/20230428-konacnirezpopisa/?a=0&s=1904",
      "source_year": 2022,
      "coverage_note": "Republic of Serbia Census 2022 final results page.",
      "official_or_imputed": "official",
      "required_for_level": "level_0_census",
      "missing_status": "anchor_values_available",
      "comments": "Use for total population and sex reconciliation."
    },
    {
      "file_name": "census_region_age_sex.csv",
      "grain": "region x age_band x sex",
      "variables": ["region", "age_band", "sex", "population_count"],
      "source_name": "Statistical Office of the Republic of Serbia / Census 2022 database",
      "source_url": "https://popis2022.stat.gov.rs/",
      "source_year": 2022,
      "coverage_note": "Expected from census dissemination tables or data portal.",
      "official_or_imputed": "official_expected",
      "required_for_level": "level_0_census",
      "missing_status": "needs_download_from_database",
      "comments": "Core IPF/raking constraint. Do not replace with LLM-generated shares."
    },
    {
      "file_name": "census_education_age_sex_region.csv",
      "grain": "region x age_band x sex x education_level",
      "variables": ["region", "age_band", "sex", "education_level", "population_15_plus_count"],
      "source_name": "Census 2022 Serbia education and literacy release / dissemination database",
      "source_url": "https://popis2022.stat.gov.rs/en-US/5-vestisaopstenja/news-events/20230731-skolska-sprema-pismenost",
      "source_year": 2022,
      "coverage_note": "Education base is population aged 15 and over. Align target population before combining with all-age tables.",
      "official_or_imputed": "official",
      "required_for_level": "level_0_census",
      "missing_status": "anchor_values_available",
      "comments": "Official anchor values are included; detailed regional table still needs extraction."
    },
    {
      "file_name": "census_computer_literacy_age_sex_region.csv",
      "grain": "region x age_band x sex x computer_literacy",
      "variables": ["region", "age_band", "sex", "computer_literacy", "population_15_plus_count"],
      "source_name": "Census 2022 Serbia education and literacy release / dissemination database",
      "source_url": "https://popis2022.stat.gov.rs/en-US/5-vestisaopstenja/news-events/20230731-skolska-sprema-pismenost",
      "source_year": 2022,
      "coverage_note": "Computer literacy base is population aged 15 and over.",
      "official_or_imputed": "official",
      "required_for_level": "level_1_survey",
      "missing_status": "anchor_values_available",
      "comments": "Use to condition digital access and online-shopping readiness."
    },
    {
      "file_name": "household_size_region.csv",
      "grain": "region x household_size",
      "variables": ["region", "household_size", "household_count", "average_household_size"],
      "source_name": "Statistical Office of the Republic of Serbia, Census 2022 households by number of members",
      "source_url": "https://www.stat.gov.rs/en-US/vesti/20230707-domacinstavapremabrclan/?a=0&s=1103",
      "source_year": 2022,
      "coverage_note": "Household-level table. Convert carefully when assigning person-level household context.",
      "official_or_imputed": "official",
      "required_for_level": "level_0_census",
      "missing_status": "anchor_values_available",
      "comments": "Use for household role, family burden, and purchase-decision context."
    },
    {
      "file_name": "ict_usage_individuals.csv",
      "grain": "country x year x ict_indicator",
      "variables": ["year", "indicator", "value", "population_base", "digital_access_level", "internet_frequency"],
      "source_name": "Statistical Office of the Republic of Serbia, Usage ICT - individuals",
      "source_url": "https://www.stat.gov.rs/en-us/oblasti/upotreba-ikt/upotreba-ikt-pojedinci/",
      "source_year": 2025,
      "coverage_note": "Individual ICT survey; age base depends on SORS ICT methodology, typically individuals aged 16-74. Use as soft-trait prior unless aligned to census bands.",
      "official_or_imputed": "survey",
      "required_for_level": "level_1_survey",
      "missing_status": "anchor_values_available",
      "comments": "Use for internet use, computer use, and social-network priors."
    },
    {
      "file_name": "employment_status_age_sex.csv",
      "grain": "age_band x sex x employment_status",
      "variables": ["age_band", "sex", "employment_status", "count_or_share"],
      "source_name": "SORS census or labour market statistics",
      "source_url": "https://www.stat.gov.rs/",
      "source_year": "2022_or_latest",
      "coverage_note": "Choose census economic activity if available for structural pack; use labour force survey for latest market context.",
      "official_or_imputed": "official_expected",
      "required_for_level": "level_0_census",
      "missing_status": "needs_source_table",
      "comments": "Required for budget pressure, time scarcity, and category need."
    },
    {
      "file_name": "income_band_region.csv",
      "grain": "region x income_band",
      "variables": ["region", "income_band", "household_or_person_count", "year", "income_decile"],
      "source_name": "SORS household budget / income and living conditions survey",
      "source_url": "https://www.stat.gov.rs/",
      "source_year": "latest_available",
      "coverage_note": "Income distribution may be survey-based rather than census-based.",
      "official_or_imputed": "official_expected",
      "required_for_level": "level_1_survey",
      "missing_status": "needs_source_table",
      "comments": "If region x income is unavailable, use national income bands plus regional wage adjustment with uncertainty penalty."
    },
    {
      "file_name": "settlement_type_region.csv",
      "grain": "region x settlement_type",
      "variables": ["region", "settlement_type", "urban_rural", "population_count"],
      "source_name": "SORS Census 2022 settlement tables",
      "source_url": "https://popis2022.stat.gov.rs/",
      "source_year": 2022,
      "coverage_note": "Use official settlement classification if available. Avoid generic global urban share when official table exists.",
      "official_or_imputed": "official_expected",
      "required_for_level": "level_0_census",
      "missing_status": "needs_source_table",
      "comments": "Controls channel access, digital behavior, logistics, and household context."
    }
  ],
  "optional_tables": [
    {
      "file_name": "marital_status_age_sex.csv",
      "grain": "age_band x sex x marital_status",
      "variables": ["age_band", "sex", "marital_status", "population_count"],
      "source_name": "SORS Census 2022",
      "source_url": "https://popis2022.stat.gov.rs/",
      "source_year": 2022,
      "coverage_note": "Optional person-level household role refinement.",
      "official_or_imputed": "official_expected",
      "required_for_level": "level_0_census",
      "missing_status": "needs_source_table",
      "comments": "Improves family decision role modeling."
    },
    {
      "file_name": "consumer_expenditure_category.csv",
      "grain": "household x expenditure_category",
      "variables": ["year", "expenditure_category", "value", "household_type"],